No.     Time        Source                Destination           Protocol Length Info
     15 8.206162    192.168.2.121         192.168.2.253         TCP      74     48339 > http [SYN] Seq=0 Win=29200 Len=0 MSS=1460 SACK_PERM=1 TSval=1080548 TSecr=0 WS=128

Frame 15: 74 bytes on wire (592 bits), 74 bytes captured (592 bits)
Ethernet II, Src: IntelCor_92:58:6a (ac:7b:a1:92:58:6a), Dst: Hewlett-_4f:a2:71 (00:0d:9d:4f:a2:71)
Internet Protocol Version 4, Src: 192.168.2.121 (192.168.2.121), Dst: 192.168.2.253 (192.168.2.253)
Transmission Control Protocol, Src Port: 48339 (48339), Dst Port: http (80), Seq: 0, Len: 0

No.     Time        Source                Destination           Protocol Length Info
     18 8.210350    192.168.2.253         192.168.2.121         TCP      74     http > 48339 [SYN, ACK] Seq=0 Ack=1 Win=14480 Len=0 MSS=1460 SACK_PERM=1 TSval=2842754454 TSecr=1080548 WS=128

Frame 18: 74 bytes on wire (592 bits), 74 bytes captured (592 bits)
Ethernet II, Src: Hewlett-_4f:a2:71 (00:0d:9d:4f:a2:71), Dst: IntelCor_92:58:6a (ac:7b:a1:92:58:6a)
Internet Protocol Version 4, Src: 192.168.2.253 (192.168.2.253), Dst: 192.168.2.121 (192.168.2.121)
Transmission Control Protocol, Src Port: http (80), Dst Port: 48339 (48339), Seq: 0, Ack: 1, Len: 0

No.     Time        Source                Destination           Protocol Length Info
     19 8.210395    192.168.2.121         192.168.2.253         TCP      66     48339 > http [ACK] Seq=1 Ack=1 Win=29312 Len=0 TSval=1080549 TSecr=2842754454

Frame 19: 66 bytes on wire (528 bits), 66 bytes captured (528 bits)
Ethernet II, Src: IntelCor_92:58:6a (ac:7b:a1:92:58:6a), Dst: Hewlett-_4f:a2:71 (00:0d:9d:4f:a2:71)
Internet Protocol Version 4, Src: 192.168.2.121 (192.168.2.121), Dst: 192.168.2.253 (192.168.2.253)
Transmission Control Protocol, Src Port: 48339 (48339), Dst Port: http (80), Seq: 1, Ack: 1, Len: 0

No.     Time        Source                Destination           Protocol Length Info
     24 8.214716    192.168.2.121         192.168.2.253         HTTP     435    GET /blll HTTP/1.1 

Frame 24: 435 bytes on wire (3480 bits), 435 bytes captured (3480 bits)
Ethernet II, Src: IntelCor_92:58:6a (ac:7b:a1:92:58:6a), Dst: Hewlett-_4f:a2:71 (00:0d:9d:4f:a2:71)
Internet Protocol Version 4, Src: 192.168.2.121 (192.168.2.121), Dst: 192.168.2.253 (192.168.2.253)
Transmission Control Protocol, Src Port: 48339 (48339), Dst Port: http (80), Seq: 1, Ack: 1, Len: 369
Hypertext Transfer Protocol

No.     Time        Source                Destination           Protocol Length Info
     25 8.223390    192.168.2.253         192.168.2.121         TCP      66     http > 48339 [ACK] Seq=1 Ack=370 Win=15616 Len=0 TSval=2842754457 TSecr=1080550

Frame 25: 66 bytes on wire (528 bits), 66 bytes captured (528 bits)
Ethernet II, Src: Hewlett-_4f:a2:71 (00:0d:9d:4f:a2:71), Dst: IntelCor_92:58:6a (ac:7b:a1:92:58:6a)
Internet Protocol Version 4, Src: 192.168.2.253 (192.168.2.253), Dst: 192.168.2.121 (192.168.2.121)
Transmission Control Protocol, Src Port: http (80), Dst Port: 48339 (48339), Seq: 1, Ack: 370, Len: 0

No.     Time        Source                Destination           Protocol Length Info
     26 8.224900    192.168.2.253         192.168.2.121         HTTP     562    HTTP/1.1 404 Not Found  (text/html)

Frame 26: 562 bytes on wire (4496 bits), 562 bytes captured (4496 bits)
Ethernet II, Src: Hewlett-_4f:a2:71 (00:0d:9d:4f:a2:71), Dst: IntelCor_92:58:6a (ac:7b:a1:92:58:6a)
Internet Protocol Version 4, Src: 192.168.2.253 (192.168.2.253), Dst: 192.168.2.121 (192.168.2.121)
Transmission Control Protocol, Src Port: http (80), Dst Port: 48339 (48339), Seq: 1, Ack: 370, Len: 496
Hypertext Transfer Protocol
Line-based text data: text/html

No.     Time        Source                Destination           Protocol Length Info
     27 8.224913    192.168.2.121         192.168.2.253         TCP      66     48339 > http [ACK] Seq=370 Ack=497 Win=30336 Len=0 TSval=1080553 TSecr=2842754457

Frame 27: 66 bytes on wire (528 bits), 66 bytes captured (528 bits)
Ethernet II, Src: IntelCor_92:58:6a (ac:7b:a1:92:58:6a), Dst: Hewlett-_4f:a2:71 (00:0d:9d:4f:a2:71)
Internet Protocol Version 4, Src: 192.168.2.121 (192.168.2.121), Dst: 192.168.2.253 (192.168.2.253)
Transmission Control Protocol, Src Port: 48339 (48339), Dst Port: http (80), Seq: 370, Ack: 497, Len: 0

No.     Time        Source                Destination           Protocol Length Info
     32 11.271194   192.168.2.121         192.168.2.253         HTTP     435    GET /blll HTTP/1.1 

Frame 32: 435 bytes on wire (3480 bits), 435 bytes captured (3480 bits)
Ethernet II, Src: IntelCor_92:58:6a (ac:7b:a1:92:58:6a), Dst: Hewlett-_4f:a2:71 (00:0d:9d:4f:a2:71)
Internet Protocol Version 4, Src: 192.168.2.121 (192.168.2.121), Dst: 192.168.2.253 (192.168.2.253)
Transmission Control Protocol, Src Port: 48339 (48339), Dst Port: http (80), Seq: 370, Ack: 497, Len: 369
Hypertext Transfer Protocol

No.     Time        Source                Destination           Protocol Length Info
     33 11.281229   192.168.2.253         192.168.2.121         HTTP     561    HTTP/1.1 404 Not Found  (text/html)

Frame 33: 561 bytes on wire (4488 bits), 561 bytes captured (4488 bits)
Ethernet II, Src: Hewlett-_4f:a2:71 (00:0d:9d:4f:a2:71), Dst: IntelCor_92:58:6a (ac:7b:a1:92:58:6a)
Internet Protocol Version 4, Src: 192.168.2.253 (192.168.2.253), Dst: 192.168.2.121 (192.168.2.121)
Transmission Control Protocol, Src Port: http (80), Dst Port: 48339 (48339), Seq: 497, Ack: 739, Len: 495
Hypertext Transfer Protocol
Line-based text data: text/html

No.     Time        Source                Destination           Protocol Length Info
     34 11.281261   192.168.2.121         192.168.2.253         TCP      66     48339 > http [ACK] Seq=739 Ack=992 Win=31360 Len=0 TSval=1081317 TSecr=2842755220

Frame 34: 66 bytes on wire (528 bits), 66 bytes captured (528 bits)
Ethernet II, Src: IntelCor_92:58:6a (ac:7b:a1:92:58:6a), Dst: Hewlett-_4f:a2:71 (00:0d:9d:4f:a2:71)
Internet Protocol Version 4, Src: 192.168.2.121 (192.168.2.121), Dst: 192.168.2.253 (192.168.2.253)
Transmission Control Protocol, Src Port: 48339 (48339), Dst Port: http (80), Seq: 739, Ack: 992, Len: 0

No.     Time        Source                Destination           Protocol Length Info
     35 14.542145   192.168.2.121         192.168.2.253         HTTP     435    GET /blll HTTP/1.1 

Frame 35: 435 bytes on wire (3480 bits), 435 bytes captured (3480 bits)
Ethernet II, Src: IntelCor_92:58:6a (ac:7b:a1:92:58:6a), Dst: Hewlett-_4f:a2:71 (00:0d:9d:4f:a2:71)
Internet Protocol Version 4, Src: 192.168.2.121 (192.168.2.121), Dst: 192.168.2.253 (192.168.2.253)
Transmission Control Protocol, Src Port: 48339 (48339), Dst Port: http (80), Seq: 739, Ack: 992, Len: 369
Hypertext Transfer Protocol

No.     Time        Source                Destination           Protocol Length Info
     36 14.547463   192.168.2.253         192.168.2.121         HTTP     561    HTTP/1.1 404 Not Found  (text/html)

Frame 36: 561 bytes on wire (4488 bits), 561 bytes captured (4488 bits)
Ethernet II, Src: Hewlett-_4f:a2:71 (00:0d:9d:4f:a2:71), Dst: IntelCor_92:58:6a (ac:7b:a1:92:58:6a)
Internet Protocol Version 4, Src: 192.168.2.253 (192.168.2.253), Dst: 192.168.2.121 (192.168.2.121)
Transmission Control Protocol, Src Port: http (80), Dst Port: 48339 (48339), Seq: 992, Ack: 1108, Len: 495
Hypertext Transfer Protocol
Line-based text data: text/html

No.     Time        Source                Destination           Protocol Length Info
     37 14.547505   192.168.2.121         192.168.2.253         TCP      66     48339 > http [ACK] Seq=1108 Ack=1487 Win=32512 Len=0 TSval=1082134 TSecr=2842756038

Frame 37: 66 bytes on wire (528 bits), 66 bytes captured (528 bits)
Ethernet II, Src: IntelCor_92:58:6a (ac:7b:a1:92:58:6a), Dst: Hewlett-_4f:a2:71 (00:0d:9d:4f:a2:71)
Internet Protocol Version 4, Src: 192.168.2.121 (192.168.2.121), Dst: 192.168.2.253 (192.168.2.253)
Transmission Control Protocol, Src Port: 48339 (48339), Dst Port: http (80), Seq: 1108, Ack: 1487, Len: 0

No.     Time        Source                Destination           Protocol Length Info
     38 18.147079   192.168.2.121         192.168.2.253         HTTP     435    GET /blll HTTP/1.1 

Frame 38: 435 bytes on wire (3480 bits), 435 bytes captured (3480 bits)
Ethernet II, Src: IntelCor_92:58:6a (ac:7b:a1:92:58:6a), Dst: Hewlett-_4f:a2:71 (00:0d:9d:4f:a2:71)
Internet Protocol Version 4, Src: 192.168.2.121 (192.168.2.121), Dst: 192.168.2.253 (192.168.2.253)
Transmission Control Protocol, Src Port: 48339 (48339), Dst Port: http (80), Seq: 1108, Ack: 1487, Len: 369
Hypertext Transfer Protocol

No.     Time        Source                Destination           Protocol Length Info
     39 18.153544   192.168.2.253         192.168.2.121         HTTP     561    HTTP/1.1 404 Not Found  (text/html)

Frame 39: 561 bytes on wire (4488 bits), 561 bytes captured (4488 bits)
Ethernet II, Src: Hewlett-_4f:a2:71 (00:0d:9d:4f:a2:71), Dst: IntelCor_92:58:6a (ac:7b:a1:92:58:6a)
Internet Protocol Version 4, Src: 192.168.2.253 (192.168.2.253), Dst: 192.168.2.121 (192.168.2.121)
Transmission Control Protocol, Src Port: http (80), Dst Port: 48339 (48339), Seq: 1487, Ack: 1477, Len: 495
Hypertext Transfer Protocol
Line-based text data: text/html

No.     Time        Source                Destination           Protocol Length Info
     40 18.153573   192.168.2.121         192.168.2.253         TCP      66     48339 > http [ACK] Seq=1477 Ack=1982 Win=33536 Len=0 TSval=1083035 TSecr=2842756939

Frame 40: 66 bytes on wire (528 bits), 66 bytes captured (528 bits)
Ethernet II, Src: IntelCor_92:58:6a (ac:7b:a1:92:58:6a), Dst: Hewlett-_4f:a2:71 (00:0d:9d:4f:a2:71)
Internet Protocol Version 4, Src: 192.168.2.121 (192.168.2.121), Dst: 192.168.2.253 (192.168.2.253)
Transmission Control Protocol, Src Port: 48339 (48339), Dst Port: http (80), Seq: 1477, Ack: 1982, Len: 0
