No.     Time           Source                Destination           Protocol Length Info
      6 0.025110000    192.168.2.121         192.168.2.253         TCP      66     48335 > http [FIN, ACK] Seq=1 Ack=1 Win=229 Len=0 TSval=1078497 TSecr=2842749814

Frame 6: 66 bytes on wire (528 bits), 66 bytes captured (528 bits) on interface 0
    Interface id: 0
    Encapsulation type: Ethernet (1)
    Arrival Time: Sep  3, 2014 22:18:05.603894000 BST
    [Time shift for this packet: 0.000000000 seconds]
    Epoch Time: 1409779085.603894000 seconds
    [Time delta from previous captured frame: 0.008919000 seconds]
    [Time delta from previous displayed frame: 0.000000000 seconds]
    [Time since reference or first frame: 0.025110000 seconds]
    Frame Number: 6
    Frame Length: 66 bytes (528 bits)
    Capture Length: 66 bytes (528 bits)
    [Frame is marked: True]
    [Frame is ignored: False]
    [Protocols in frame: eth:ip:tcp]
    [Coloring Rule Name: ___conversation_color_filter___01]
    [Coloring Rule String: ip.addr eq 192.168.2.121 and ip.addr eq 192.168.2.253]
Ethernet II, Src: IntelCor_92:58:6a (ac:7b:a1:92:58:6a), Dst: Hewlett-_4f:a2:71 (00:0d:9d:4f:a2:71)
    Destination: Hewlett-_4f:a2:71 (00:0d:9d:4f:a2:71)
        Address: Hewlett-_4f:a2:71 (00:0d:9d:4f:a2:71)
        .... ..0. .... .... .... .... = LG bit: Globally unique address (factory default)
        .... ...0 .... .... .... .... = IG bit: Individual address (unicast)
    Source: IntelCor_92:58:6a (ac:7b:a1:92:58:6a)
        Address: IntelCor_92:58:6a (ac:7b:a1:92:58:6a)
        .... ..0. .... .... .... .... = LG bit: Globally unique address (factory default)
        .... ...0 .... .... .... .... = IG bit: Individual address (unicast)
    Type: IP (0x0800)
Internet Protocol Version 4, Src: 192.168.2.121 (192.168.2.121), Dst: 192.168.2.253 (192.168.2.253)
    Version: 4
    Header length: 20 bytes
    Differentiated Services Field: 0x00 (DSCP 0x00: Default; ECN: 0x00: Not-ECT (Not ECN-Capable Transport))
        0000 00.. = Differentiated Services Codepoint: Default (0x00)
        .... ..00 = Explicit Congestion Notification: Not-ECT (Not ECN-Capable Transport) (0x00)
    Total Length: 52
    Identification: 0x6576 (25974)
    Flags: 0x02 (Don't Fragment)
        0... .... = Reserved bit: Not set
        .1.. .... = Don't fragment: Set
        ..0. .... = More fragments: Not set
    Fragment offset: 0
    Time to live: 64
    Protocol: TCP (6)
    Header checksum: 0x4e87 [validation disabled]
        [Good: False]
        [Bad: False]
    Source: 192.168.2.121 (192.168.2.121)
    Destination: 192.168.2.253 (192.168.2.253)
    [Source GeoIP: Unknown]
    [Destination GeoIP: Unknown]
Transmission Control Protocol, Src Port: 48335 (48335), Dst Port: http (80), Seq: 1, Ack: 1, Len: 0
    Source port: 48335 (48335)
    Destination port: http (80)
    [Stream index: 1]
    Sequence number: 1    (relative sequence number)
    Acknowledgment number: 1    (relative ack number)
    Header length: 32 bytes
    Flags: 0x011 (FIN, ACK)
        000. .... .... = Reserved: Not set
        ...0 .... .... = Nonce: Not set
        .... 0... .... = Congestion Window Reduced (CWR): Not set
        .... .0.. .... = ECN-Echo: Not set
        .... ..0. .... = Urgent: Not set
        .... ...1 .... = Acknowledgment: Set
        .... .... 0... = Push: Not set
        .... .... .0.. = Reset: Not set
        .... .... ..0. = Syn: Not set
        .... .... ...1 = Fin: Set
            [Expert Info (Chat/Sequence): Connection finish (FIN)]
                [Message: Connection finish (FIN)]
                [Severity level: Chat]
                [Group: Sequence]
    Window size value: 229
    [Calculated window size: 229]
    [Window size scaling factor: -1 (unknown)]
    Checksum: 0xeeb4 [validation disabled]
        [Good Checksum: False]
        [Bad Checksum: False]
    Options: (12 bytes), No-Operation (NOP), No-Operation (NOP), Timestamps
        No-Operation (NOP)
            Type: 1
                0... .... = Copy on fragmentation: No
                .00. .... = Class: Control (0)
                ...0 0001 = Number: No-Operation (NOP) (1)
        No-Operation (NOP)
            Type: 1
                0... .... = Copy on fragmentation: No
                .00. .... = Class: Control (0)
                ...0 0001 = Number: No-Operation (NOP) (1)
        Timestamps: TSval 1078497, TSecr 2842749814
            Kind: Timestamp (8)
            Length: 10
            Timestamp value: 1078497
            Timestamp echo reply: 2842749814

0000  00 0d 9d 4f a2 71 ac 7b a1 92 58 6a 08 00 45 00   ...O.q.{..Xj..E.
0010  00 34 65 76 40 00 40 06 4e 87 c0 a8 02 79 c0 a8   .4ev@.@.N....y..
0020  02 fd bc cf 00 50 d8 fa 0f cd a2 8e ae 0c 80 11   .....P..........
0030  00 e5 ee b4 00 00 01 01 08 0a 00 10 74 e1 a9 70   ............t..p
0040  eb 76                                             .v

No.     Time           Source                Destination           Protocol Length Info
      7 0.025220000    192.168.2.121         192.168.2.253         TCP      66     48336 > http [FIN, ACK] Seq=1 Ack=1 Win=229 Len=0 TSval=1078497 TSecr=2842749814

Frame 7: 66 bytes on wire (528 bits), 66 bytes captured (528 bits) on interface 0
    Interface id: 0
    Encapsulation type: Ethernet (1)
    Arrival Time: Sep  3, 2014 22:18:05.604004000 BST
    [Time shift for this packet: 0.000000000 seconds]
    Epoch Time: 1409779085.604004000 seconds
    [Time delta from previous captured frame: 0.000110000 seconds]
    [Time delta from previous displayed frame: 0.000110000 seconds]
    [Time since reference or first frame: 0.025220000 seconds]
    Frame Number: 7
    Frame Length: 66 bytes (528 bits)
    Capture Length: 66 bytes (528 bits)
    [Frame is marked: True]
    [Frame is ignored: False]
    [Protocols in frame: eth:ip:tcp]
    [Coloring Rule Name: ___conversation_color_filter___01]
    [Coloring Rule String: ip.addr eq 192.168.2.121 and ip.addr eq 192.168.2.253]
Ethernet II, Src: IntelCor_92:58:6a (ac:7b:a1:92:58:6a), Dst: Hewlett-_4f:a2:71 (00:0d:9d:4f:a2:71)
    Destination: Hewlett-_4f:a2:71 (00:0d:9d:4f:a2:71)
        Address: Hewlett-_4f:a2:71 (00:0d:9d:4f:a2:71)
        .... ..0. .... .... .... .... = LG bit: Globally unique address (factory default)
        .... ...0 .... .... .... .... = IG bit: Individual address (unicast)
    Source: IntelCor_92:58:6a (ac:7b:a1:92:58:6a)
        Address: IntelCor_92:58:6a (ac:7b:a1:92:58:6a)
        .... ..0. .... .... .... .... = LG bit: Globally unique address (factory default)
        .... ...0 .... .... .... .... = IG bit: Individual address (unicast)
    Type: IP (0x0800)
Internet Protocol Version 4, Src: 192.168.2.121 (192.168.2.121), Dst: 192.168.2.253 (192.168.2.253)
    Version: 4
    Header length: 20 bytes
    Differentiated Services Field: 0x00 (DSCP 0x00: Default; ECN: 0x00: Not-ECT (Not ECN-Capable Transport))
        0000 00.. = Differentiated Services Codepoint: Default (0x00)
        .... ..00 = Explicit Congestion Notification: Not-ECT (Not ECN-Capable Transport) (0x00)
    Total Length: 52
    Identification: 0x0376 (886)
    Flags: 0x02 (Don't Fragment)
        0... .... = Reserved bit: Not set
        .1.. .... = Don't fragment: Set
        ..0. .... = More fragments: Not set
    Fragment offset: 0
    Time to live: 64
    Protocol: TCP (6)
    Header checksum: 0xb087 [validation disabled]
        [Good: False]
        [Bad: False]
    Source: 192.168.2.121 (192.168.2.121)
    Destination: 192.168.2.253 (192.168.2.253)
    [Source GeoIP: Unknown]
    [Destination GeoIP: Unknown]
Transmission Control Protocol, Src Port: 48336 (48336), Dst Port: http (80), Seq: 1, Ack: 1, Len: 0
    Source port: 48336 (48336)
    Destination port: http (80)
    [Stream index: 2]
    Sequence number: 1    (relative sequence number)
    Acknowledgment number: 1    (relative ack number)
    Header length: 32 bytes
    Flags: 0x011 (FIN, ACK)
        000. .... .... = Reserved: Not set
        ...0 .... .... = Nonce: Not set
        .... 0... .... = Congestion Window Reduced (CWR): Not set
        .... .0.. .... = ECN-Echo: Not set
        .... ..0. .... = Urgent: Not set
        .... ...1 .... = Acknowledgment: Set
        .... .... 0... = Push: Not set
        .... .... .0.. = Reset: Not set
        .... .... ..0. = Syn: Not set
        .... .... ...1 = Fin: Set
            [Expert Info (Chat/Sequence): Connection finish (FIN)]
                [Message: Connection finish (FIN)]
                [Severity level: Chat]
                [Group: Sequence]
    Window size value: 229
    [Calculated window size: 229]
    [Window size scaling factor: -1 (unknown)]
    Checksum: 0xa303 [validation disabled]
        [Good Checksum: False]
        [Bad Checksum: False]
    Options: (12 bytes), No-Operation (NOP), No-Operation (NOP), Timestamps
        No-Operation (NOP)
            Type: 1
                0... .... = Copy on fragmentation: No
                .00. .... = Class: Control (0)
                ...0 0001 = Number: No-Operation (NOP) (1)
        No-Operation (NOP)
            Type: 1
                0... .... = Copy on fragmentation: No
                .00. .... = Class: Control (0)
                ...0 0001 = Number: No-Operation (NOP) (1)
        Timestamps: TSval 1078497, TSecr 2842749814
            Kind: Timestamp (8)
            Length: 10
            Timestamp value: 1078497
            Timestamp echo reply: 2842749814

0000  00 0d 9d 4f a2 71 ac 7b a1 92 58 6a 08 00 45 00   ...O.q.{..Xj..E.
0010  00 34 03 76 40 00 40 06 b0 87 c0 a8 02 79 c0 a8   .4.v@.@......y..
0020  02 fd bc d0 00 50 6d d9 69 cd 45 93 67 d9 80 11   .....Pm.i.E.g...
0030  00 e5 a3 03 00 00 01 01 08 0a 00 10 74 e1 a9 70   ............t..p
0040  eb 76                                             .v

No.     Time           Source                Destination           Protocol Length Info
      8 0.025269000    192.168.2.121         192.168.2.253         TCP      66     48337 > http [FIN, ACK] Seq=1 Ack=1 Win=229 Len=0 TSval=1078497 TSecr=2842749814

Frame 8: 66 bytes on wire (528 bits), 66 bytes captured (528 bits) on interface 0
    Interface id: 0
    Encapsulation type: Ethernet (1)
    Arrival Time: Sep  3, 2014 22:18:05.604053000 BST
    [Time shift for this packet: 0.000000000 seconds]
    Epoch Time: 1409779085.604053000 seconds
    [Time delta from previous captured frame: 0.000049000 seconds]
    [Time delta from previous displayed frame: 0.000049000 seconds]
    [Time since reference or first frame: 0.025269000 seconds]
    Frame Number: 8
    Frame Length: 66 bytes (528 bits)
    Capture Length: 66 bytes (528 bits)
    [Frame is marked: True]
    [Frame is ignored: False]
    [Protocols in frame: eth:ip:tcp]
    [Coloring Rule Name: ___conversation_color_filter___01]
    [Coloring Rule String: ip.addr eq 192.168.2.121 and ip.addr eq 192.168.2.253]
Ethernet II, Src: IntelCor_92:58:6a (ac:7b:a1:92:58:6a), Dst: Hewlett-_4f:a2:71 (00:0d:9d:4f:a2:71)
    Destination: Hewlett-_4f:a2:71 (00:0d:9d:4f:a2:71)
        Address: Hewlett-_4f:a2:71 (00:0d:9d:4f:a2:71)
        .... ..0. .... .... .... .... = LG bit: Globally unique address (factory default)
        .... ...0 .... .... .... .... = IG bit: Individual address (unicast)
    Source: IntelCor_92:58:6a (ac:7b:a1:92:58:6a)
        Address: IntelCor_92:58:6a (ac:7b:a1:92:58:6a)
        .... ..0. .... .... .... .... = LG bit: Globally unique address (factory default)
        .... ...0 .... .... .... .... = IG bit: Individual address (unicast)
    Type: IP (0x0800)
Internet Protocol Version 4, Src: 192.168.2.121 (192.168.2.121), Dst: 192.168.2.253 (192.168.2.253)
    Version: 4
    Header length: 20 bytes
    Differentiated Services Field: 0x00 (DSCP 0x00: Default; ECN: 0x00: Not-ECT (Not ECN-Capable Transport))
        0000 00.. = Differentiated Services Codepoint: Default (0x00)
        .... ..00 = Explicit Congestion Notification: Not-ECT (Not ECN-Capable Transport) (0x00)
    Total Length: 52
    Identification: 0x1e10 (7696)
    Flags: 0x02 (Don't Fragment)
        0... .... = Reserved bit: Not set
        .1.. .... = Don't fragment: Set
        ..0. .... = More fragments: Not set
    Fragment offset: 0
    Time to live: 64
    Protocol: TCP (6)
    Header checksum: 0x95ed [validation disabled]
        [Good: False]
        [Bad: False]
    Source: 192.168.2.121 (192.168.2.121)
    Destination: 192.168.2.253 (192.168.2.253)
    [Source GeoIP: Unknown]
    [Destination GeoIP: Unknown]
Transmission Control Protocol, Src Port: 48337 (48337), Dst Port: http (80), Seq: 1, Ack: 1, Len: 0
    Source port: 48337 (48337)
    Destination port: http (80)
    [Stream index: 3]
    Sequence number: 1    (relative sequence number)
    Acknowledgment number: 1    (relative ack number)
    Header length: 32 bytes
    Flags: 0x011 (FIN, ACK)
        000. .... .... = Reserved: Not set
        ...0 .... .... = Nonce: Not set
        .... 0... .... = Congestion Window Reduced (CWR): Not set
        .... .0.. .... = ECN-Echo: Not set
        .... ..0. .... = Urgent: Not set
        .... ...1 .... = Acknowledgment: Set
        .... .... 0... = Push: Not set
        .... .... .0.. = Reset: Not set
        .... .... ..0. = Syn: Not set
        .... .... ...1 = Fin: Set
            [Expert Info (Chat/Sequence): Connection finish (FIN)]
                [Message: Connection finish (FIN)]
                [Severity level: Chat]
                [Group: Sequence]
    Window size value: 229
    [Calculated window size: 229]
    [Window size scaling factor: -1 (unknown)]
    Checksum: 0xa482 [validation disabled]
        [Good Checksum: False]
        [Bad Checksum: False]
    Options: (12 bytes), No-Operation (NOP), No-Operation (NOP), Timestamps
        No-Operation (NOP)
            Type: 1
                0... .... = Copy on fragmentation: No
                .00. .... = Class: Control (0)
                ...0 0001 = Number: No-Operation (NOP) (1)
        No-Operation (NOP)
            Type: 1
                0... .... = Copy on fragmentation: No
                .00. .... = Class: Control (0)
                ...0 0001 = Number: No-Operation (NOP) (1)
        Timestamps: TSval 1078497, TSecr 2842749814
            Kind: Timestamp (8)
            Length: 10
            Timestamp value: 1078497
            Timestamp echo reply: 2842749814

0000  00 0d 9d 4f a2 71 ac 7b a1 92 58 6a 08 00 45 00   ...O.q.{..Xj..E.
0010  00 34 1e 10 40 00 40 06 95 ed c0 a8 02 79 c0 a8   .4..@.@......y..
0020  02 fd bc d1 00 50 72 a2 74 b3 60 31 3c 0c 80 11   .....Pr.t.`1<...
0030  00 e5 a4 82 00 00 01 01 08 0a 00 10 74 e1 a9 70   ............t..p
0040  eb 76                                             .v

No.     Time           Source                Destination           Protocol Length Info
      9 0.025290000    192.168.2.121         192.168.2.253         TCP      66     48338 > http [FIN, ACK] Seq=1 Ack=1 Win=229 Len=0 TSval=1078497 TSecr=2842749814

Frame 9: 66 bytes on wire (528 bits), 66 bytes captured (528 bits) on interface 0
    Interface id: 0
    Encapsulation type: Ethernet (1)
    Arrival Time: Sep  3, 2014 22:18:05.604074000 BST
    [Time shift for this packet: 0.000000000 seconds]
    Epoch Time: 1409779085.604074000 seconds
    [Time delta from previous captured frame: 0.000021000 seconds]
    [Time delta from previous displayed frame: 0.000021000 seconds]
    [Time since reference or first frame: 0.025290000 seconds]
    Frame Number: 9
    Frame Length: 66 bytes (528 bits)
    Capture Length: 66 bytes (528 bits)
    [Frame is marked: True]
    [Frame is ignored: False]
    [Protocols in frame: eth:ip:tcp]
    [Coloring Rule Name: ___conversation_color_filter___01]
    [Coloring Rule String: ip.addr eq 192.168.2.121 and ip.addr eq 192.168.2.253]
Ethernet II, Src: IntelCor_92:58:6a (ac:7b:a1:92:58:6a), Dst: Hewlett-_4f:a2:71 (00:0d:9d:4f:a2:71)
    Destination: Hewlett-_4f:a2:71 (00:0d:9d:4f:a2:71)
        Address: Hewlett-_4f:a2:71 (00:0d:9d:4f:a2:71)
        .... ..0. .... .... .... .... = LG bit: Globally unique address (factory default)
        .... ...0 .... .... .... .... = IG bit: Individual address (unicast)
    Source: IntelCor_92:58:6a (ac:7b:a1:92:58:6a)
        Address: IntelCor_92:58:6a (ac:7b:a1:92:58:6a)
        .... ..0. .... .... .... .... = LG bit: Globally unique address (factory default)
        .... ...0 .... .... .... .... = IG bit: Individual address (unicast)
    Type: IP (0x0800)
Internet Protocol Version 4, Src: 192.168.2.121 (192.168.2.121), Dst: 192.168.2.253 (192.168.2.253)
    Version: 4
    Header length: 20 bytes
    Differentiated Services Field: 0x00 (DSCP 0x00: Default; ECN: 0x00: Not-ECT (Not ECN-Capable Transport))
        0000 00.. = Differentiated Services Codepoint: Default (0x00)
        .... ..00 = Explicit Congestion Notification: Not-ECT (Not ECN-Capable Transport) (0x00)
    Total Length: 52
    Identification: 0x9adf (39647)
    Flags: 0x02 (Don't Fragment)
        0... .... = Reserved bit: Not set
        .1.. .... = Don't fragment: Set
        ..0. .... = More fragments: Not set
    Fragment offset: 0
    Time to live: 64
    Protocol: TCP (6)
    Header checksum: 0x191e [validation disabled]
        [Good: False]
        [Bad: False]
    Source: 192.168.2.121 (192.168.2.121)
    Destination: 192.168.2.253 (192.168.2.253)
    [Source GeoIP: Unknown]
    [Destination GeoIP: Unknown]
Transmission Control Protocol, Src Port: 48338 (48338), Dst Port: http (80), Seq: 1, Ack: 1, Len: 0
    Source port: 48338 (48338)
    Destination port: http (80)
    [Stream index: 4]
    Sequence number: 1    (relative sequence number)
    Acknowledgment number: 1    (relative ack number)
    Header length: 32 bytes
    Flags: 0x011 (FIN, ACK)
        000. .... .... = Reserved: Not set
        ...0 .... .... = Nonce: Not set
        .... 0... .... = Congestion Window Reduced (CWR): Not set
        .... .0.. .... = ECN-Echo: Not set
        .... ..0. .... = Urgent: Not set
        .... ...1 .... = Acknowledgment: Set
        .... .... 0... = Push: Not set
        .... .... .0.. = Reset: Not set
        .... .... ..0. = Syn: Not set
        .... .... ...1 = Fin: Set
            [Expert Info (Chat/Sequence): Connection finish (FIN)]
                [Message: Connection finish (FIN)]
                [Severity level: Chat]
                [Group: Sequence]
    Window size value: 229
    [Calculated window size: 229]
    [Window size scaling factor: -1 (unknown)]
    Checksum: 0x8fa1 [validation disabled]
        [Good Checksum: False]
        [Bad Checksum: False]
    Options: (12 bytes), No-Operation (NOP), No-Operation (NOP), Timestamps
        No-Operation (NOP)
            Type: 1
                0... .... = Copy on fragmentation: No
                .00. .... = Class: Control (0)
                ...0 0001 = Number: No-Operation (NOP) (1)
        No-Operation (NOP)
            Type: 1
                0... .... = Copy on fragmentation: No
                .00. .... = Class: Control (0)
                ...0 0001 = Number: No-Operation (NOP) (1)
        Timestamps: TSval 1078497, TSecr 2842749814
            Kind: Timestamp (8)
            Length: 10
            Timestamp value: 1078497
            Timestamp echo reply: 2842749814

0000  00 0d 9d 4f a2 71 ac 7b a1 92 58 6a 08 00 45 00   ...O.q.{..Xj..E.
0010  00 34 9a df 40 00 40 06 19 1e c0 a8 02 79 c0 a8   .4..@.@......y..
0020  02 fd bc d2 00 50 c8 84 f0 1d 19 a4 c6 2c 80 11   .....P.......,..
0030  00 e5 8f a1 00 00 01 01 08 0a 00 10 74 e1 a9 70   ............t..p
0040  eb 76                                             .v

No.     Time           Source                Destination           Protocol Length Info
     10 0.025315000    192.168.2.121         192.168.2.253         TCP      66     48334 > http [FIN, ACK] Seq=1 Ack=1 Win=237 Len=0 TSval=1078497 TSecr=2842751069

Frame 10: 66 bytes on wire (528 bits), 66 bytes captured (528 bits) on interface 0
    Interface id: 0
    Encapsulation type: Ethernet (1)
    Arrival Time: Sep  3, 2014 22:18:05.604099000 BST
    [Time shift for this packet: 0.000000000 seconds]
    Epoch Time: 1409779085.604099000 seconds
    [Time delta from previous captured frame: 0.000025000 seconds]
    [Time delta from previous displayed frame: 0.000025000 seconds]
    [Time since reference or first frame: 0.025315000 seconds]
    Frame Number: 10
    Frame Length: 66 bytes (528 bits)
    Capture Length: 66 bytes (528 bits)
    [Frame is marked: True]
    [Frame is ignored: False]
    [Protocols in frame: eth:ip:tcp]
    [Coloring Rule Name: ___conversation_color_filter___01]
    [Coloring Rule String: ip.addr eq 192.168.2.121 and ip.addr eq 192.168.2.253]
Ethernet II, Src: IntelCor_92:58:6a (ac:7b:a1:92:58:6a), Dst: Hewlett-_4f:a2:71 (00:0d:9d:4f:a2:71)
    Destination: Hewlett-_4f:a2:71 (00:0d:9d:4f:a2:71)
        Address: Hewlett-_4f:a2:71 (00:0d:9d:4f:a2:71)
        .... ..0. .... .... .... .... = LG bit: Globally unique address (factory default)
        .... ...0 .... .... .... .... = IG bit: Individual address (unicast)
    Source: IntelCor_92:58:6a (ac:7b:a1:92:58:6a)
        Address: IntelCor_92:58:6a (ac:7b:a1:92:58:6a)
        .... ..0. .... .... .... .... = LG bit: Globally unique address (factory default)
        .... ...0 .... .... .... .... = IG bit: Individual address (unicast)
    Type: IP (0x0800)
Internet Protocol Version 4, Src: 192.168.2.121 (192.168.2.121), Dst: 192.168.2.253 (192.168.2.253)
    Version: 4
    Header length: 20 bytes
    Differentiated Services Field: 0x00 (DSCP 0x00: Default; ECN: 0x00: Not-ECT (Not ECN-Capable Transport))
        0000 00.. = Differentiated Services Codepoint: Default (0x00)
        .... ..00 = Explicit Congestion Notification: Not-ECT (Not ECN-Capable Transport) (0x00)
    Total Length: 52
    Identification: 0xfdf7 (65015)
    Flags: 0x02 (Don't Fragment)
        0... .... = Reserved bit: Not set
        .1.. .... = Don't fragment: Set
        ..0. .... = More fragments: Not set
    Fragment offset: 0
    Time to live: 64
    Protocol: TCP (6)
    Header checksum: 0xb605 [validation disabled]
        [Good: False]
        [Bad: False]
    Source: 192.168.2.121 (192.168.2.121)
    Destination: 192.168.2.253 (192.168.2.253)
    [Source GeoIP: Unknown]
    [Destination GeoIP: Unknown]
Transmission Control Protocol, Src Port: 48334 (48334), Dst Port: http (80), Seq: 1, Ack: 1, Len: 0
    Source port: 48334 (48334)
    Destination port: http (80)
    [Stream index: 5]
    Sequence number: 1    (relative sequence number)
    Acknowledgment number: 1    (relative ack number)
    Header length: 32 bytes
    Flags: 0x011 (FIN, ACK)
        000. .... .... = Reserved: Not set
        ...0 .... .... = Nonce: Not set
        .... 0... .... = Congestion Window Reduced (CWR): Not set
        .... .0.. .... = ECN-Echo: Not set
        .... ..0. .... = Urgent: Not set
        .... ...1 .... = Acknowledgment: Set
        .... .... 0... = Push: Not set
        .... .... .0.. = Reset: Not set
        .... .... ..0. = Syn: Not set
        .... .... ...1 = Fin: Set
            [Expert Info (Chat/Sequence): Connection finish (FIN)]
                [Message: Connection finish (FIN)]
                [Severity level: Chat]
                [Group: Sequence]
    Window size value: 237
    [Calculated window size: 237]
    [Window size scaling factor: -1 (unknown)]
    Checksum: 0x9ddb [validation disabled]
        [Good Checksum: False]
        [Bad Checksum: False]
    Options: (12 bytes), No-Operation (NOP), No-Operation (NOP), Timestamps
        No-Operation (NOP)
            Type: 1
                0... .... = Copy on fragmentation: No
                .00. .... = Class: Control (0)
                ...0 0001 = Number: No-Operation (NOP) (1)
        No-Operation (NOP)
            Type: 1
                0... .... = Copy on fragmentation: No
                .00. .... = Class: Control (0)
                ...0 0001 = Number: No-Operation (NOP) (1)
        Timestamps: TSval 1078497, TSecr 2842751069
            Kind: Timestamp (8)
            Length: 10
            Timestamp value: 1078497
            Timestamp echo reply: 2842751069

0000  00 0d 9d 4f a2 71 ac 7b a1 92 58 6a 08 00 45 00   ...O.q.{..Xj..E.
0010  00 34 fd f7 40 00 40 06 b6 05 c0 a8 02 79 c0 a8   .4..@.@......y..
0020  02 fd bc ce 00 50 4d ee 98 a5 b5 78 e9 41 80 11   .....PM....x.A..
0030  00 ed 9d db 00 00 01 01 08 0a 00 10 74 e1 a9 70   ............t..p
0040  f0 5d                                             .]

No.     Time           Source                Destination           Protocol Length Info
     11 0.029218000    192.168.2.253         192.168.2.121         TCP      66     http > 48335 [FIN, ACK] Seq=1 Ack=2 Win=114 Len=0 TSval=2842752402 TSecr=1078497

Frame 11: 66 bytes on wire (528 bits), 66 bytes captured (528 bits) on interface 0
    Interface id: 0
    Encapsulation type: Ethernet (1)
    Arrival Time: Sep  3, 2014 22:18:05.608002000 BST
    [Time shift for this packet: 0.000000000 seconds]
    Epoch Time: 1409779085.608002000 seconds
    [Time delta from previous captured frame: 0.003903000 seconds]
    [Time delta from previous displayed frame: 0.003903000 seconds]
    [Time since reference or first frame: 0.029218000 seconds]
    Frame Number: 11
    Frame Length: 66 bytes (528 bits)
    Capture Length: 66 bytes (528 bits)
    [Frame is marked: True]
    [Frame is ignored: False]
    [Protocols in frame: eth:ip:tcp]
    [Coloring Rule Name: ___conversation_color_filter___01]
    [Coloring Rule String: ip.addr eq 192.168.2.121 and ip.addr eq 192.168.2.253]
Ethernet II, Src: Hewlett-_4f:a2:71 (00:0d:9d:4f:a2:71), Dst: IntelCor_92:58:6a (ac:7b:a1:92:58:6a)
    Destination: IntelCor_92:58:6a (ac:7b:a1:92:58:6a)
        Address: IntelCor_92:58:6a (ac:7b:a1:92:58:6a)
        .... ..0. .... .... .... .... = LG bit: Globally unique address (factory default)
        .... ...0 .... .... .... .... = IG bit: Individual address (unicast)
    Source: Hewlett-_4f:a2:71 (00:0d:9d:4f:a2:71)
        Address: Hewlett-_4f:a2:71 (00:0d:9d:4f:a2:71)
        .... ..0. .... .... .... .... = LG bit: Globally unique address (factory default)
        .... ...0 .... .... .... .... = IG bit: Individual address (unicast)
    Type: IP (0x0800)
Internet Protocol Version 4, Src: 192.168.2.253 (192.168.2.253), Dst: 192.168.2.121 (192.168.2.121)
    Version: 4
    Header length: 20 bytes
    Differentiated Services Field: 0x00 (DSCP 0x00: Default; ECN: 0x00: Not-ECT (Not ECN-Capable Transport))
        0000 00.. = Differentiated Services Codepoint: Default (0x00)
        .... ..00 = Explicit Congestion Notification: Not-ECT (Not ECN-Capable Transport) (0x00)
    Total Length: 52
    Identification: 0x42dc (17116)
    Flags: 0x02 (Don't Fragment)
        0... .... = Reserved bit: Not set
        .1.. .... = Don't fragment: Set
        ..0. .... = More fragments: Not set
    Fragment offset: 0
    Time to live: 64
    Protocol: TCP (6)
    Header checksum: 0x7121 [validation disabled]
        [Good: False]
        [Bad: False]
    Source: 192.168.2.253 (192.168.2.253)
    Destination: 192.168.2.121 (192.168.2.121)
    [Source GeoIP: Unknown]
    [Destination GeoIP: Unknown]
Transmission Control Protocol, Src Port: http (80), Dst Port: 48335 (48335), Seq: 1, Ack: 2, Len: 0
    Source port: http (80)
    Destination port: 48335 (48335)
    [Stream index: 1]
    Sequence number: 1    (relative sequence number)
    Acknowledgment number: 2    (relative ack number)
    Header length: 32 bytes
    Flags: 0x011 (FIN, ACK)
        000. .... .... = Reserved: Not set
        ...0 .... .... = Nonce: Not set
        .... 0... .... = Congestion Window Reduced (CWR): Not set
        .... .0.. .... = ECN-Echo: Not set
        .... ..0. .... = Urgent: Not set
        .... ...1 .... = Acknowledgment: Set
        .... .... 0... = Push: Not set
        .... .... .0.. = Reset: Not set
        .... .... ..0. = Syn: Not set
        .... .... ...1 = Fin: Set
            [Expert Info (Chat/Sequence): Connection finish (FIN)]
                [Message: Connection finish (FIN)]
                [Severity level: Chat]
                [Group: Sequence]
    Window size value: 114
    [Calculated window size: 114]
    [Window size scaling factor: -1 (unknown)]
    Checksum: 0xe50a [validation disabled]
        [Good Checksum: False]
        [Bad Checksum: False]
    Options: (12 bytes), No-Operation (NOP), No-Operation (NOP), Timestamps
        No-Operation (NOP)
            Type: 1
                0... .... = Copy on fragmentation: No
                .00. .... = Class: Control (0)
                ...0 0001 = Number: No-Operation (NOP) (1)
        No-Operation (NOP)
            Type: 1
                0... .... = Copy on fragmentation: No
                .00. .... = Class: Control (0)
                ...0 0001 = Number: No-Operation (NOP) (1)
        Timestamps: TSval 2842752402, TSecr 1078497
            Kind: Timestamp (8)
            Length: 10
            Timestamp value: 2842752402
            Timestamp echo reply: 1078497
    [SEQ/ACK analysis]
        [This is an ACK to the segment in frame: 6]
        [The RTT to ACK the segment was: 0.004108000 seconds]

0000  ac 7b a1 92 58 6a 00 0d 9d 4f a2 71 08 00 45 00   .{..Xj...O.q..E.
0010  00 34 42 dc 40 00 40 06 71 21 c0 a8 02 fd c0 a8   .4B.@.@.q!......
0020  02 79 00 50 bc cf a2 8e ae 0c d8 fa 0f ce 80 11   .y.P............
0030  00 72 e5 0a 00 00 01 01 08 0a a9 70 f5 92 00 10   .r.........p....
0040  74 e1                                             t.

No.     Time           Source                Destination           Protocol Length Info
     12 0.029266000    192.168.2.121         192.168.2.253         TCP      66     48335 > http [ACK] Seq=2 Ack=2 Win=229 Len=0 TSval=1078498 TSecr=2842752402

Frame 12: 66 bytes on wire (528 bits), 66 bytes captured (528 bits) on interface 0
    Interface id: 0
    Encapsulation type: Ethernet (1)
    Arrival Time: Sep  3, 2014 22:18:05.608050000 BST
    [Time shift for this packet: 0.000000000 seconds]
    Epoch Time: 1409779085.608050000 seconds
    [Time delta from previous captured frame: 0.000048000 seconds]
    [Time delta from previous displayed frame: 0.000048000 seconds]
    [Time since reference or first frame: 0.029266000 seconds]
    Frame Number: 12
    Frame Length: 66 bytes (528 bits)
    Capture Length: 66 bytes (528 bits)
    [Frame is marked: True]
    [Frame is ignored: False]
    [Protocols in frame: eth:ip:tcp]
    [Coloring Rule Name: ___conversation_color_filter___01]
    [Coloring Rule String: ip.addr eq 192.168.2.121 and ip.addr eq 192.168.2.253]
Ethernet II, Src: IntelCor_92:58:6a (ac:7b:a1:92:58:6a), Dst: Hewlett-_4f:a2:71 (00:0d:9d:4f:a2:71)
    Destination: Hewlett-_4f:a2:71 (00:0d:9d:4f:a2:71)
        Address: Hewlett-_4f:a2:71 (00:0d:9d:4f:a2:71)
        .... ..0. .... .... .... .... = LG bit: Globally unique address (factory default)
        .... ...0 .... .... .... .... = IG bit: Individual address (unicast)
    Source: IntelCor_92:58:6a (ac:7b:a1:92:58:6a)
        Address: IntelCor_92:58:6a (ac:7b:a1:92:58:6a)
        .... ..0. .... .... .... .... = LG bit: Globally unique address (factory default)
        .... ...0 .... .... .... .... = IG bit: Individual address (unicast)
    Type: IP (0x0800)
Internet Protocol Version 4, Src: 192.168.2.121 (192.168.2.121), Dst: 192.168.2.253 (192.168.2.253)
    Version: 4
    Header length: 20 bytes
    Differentiated Services Field: 0x00 (DSCP 0x00: Default; ECN: 0x00: Not-ECT (Not ECN-Capable Transport))
        0000 00.. = Differentiated Services Codepoint: Default (0x00)
        .... ..00 = Explicit Congestion Notification: Not-ECT (Not ECN-Capable Transport) (0x00)
    Total Length: 52
    Identification: 0x6577 (25975)
    Flags: 0x02 (Don't Fragment)
        0... .... = Reserved bit: Not set
        .1.. .... = Don't fragment: Set
        ..0. .... = More fragments: Not set
    Fragment offset: 0
    Time to live: 64
    Protocol: TCP (6)
    Header checksum: 0x4e86 [validation disabled]
        [Good: False]
        [Bad: False]
    Source: 192.168.2.121 (192.168.2.121)
    Destination: 192.168.2.253 (192.168.2.253)
    [Source GeoIP: Unknown]
    [Destination GeoIP: Unknown]
Transmission Control Protocol, Src Port: 48335 (48335), Dst Port: http (80), Seq: 2, Ack: 2, Len: 0
    Source port: 48335 (48335)
    Destination port: http (80)
    [Stream index: 1]
    Sequence number: 2    (relative sequence number)
    Acknowledgment number: 2    (relative ack number)
    Header length: 32 bytes
    Flags: 0x010 (ACK)
        000. .... .... = Reserved: Not set
        ...0 .... .... = Nonce: Not set
        .... 0... .... = Congestion Window Reduced (CWR): Not set
        .... .0.. .... = ECN-Echo: Not set
        .... ..0. .... = Urgent: Not set
        .... ...1 .... = Acknowledgment: Set
        .... .... 0... = Push: Not set
        .... .... .0.. = Reset: Not set
        .... .... ..0. = Syn: Not set
        .... .... ...0 = Fin: Not set
    Window size value: 229
    [Calculated window size: 229]
    [Window size scaling factor: -1 (unknown)]
    Checksum: 0xe496 [validation disabled]
        [Good Checksum: False]
        [Bad Checksum: False]
    Options: (12 bytes), No-Operation (NOP), No-Operation (NOP), Timestamps
        No-Operation (NOP)
            Type: 1
                0... .... = Copy on fragmentation: No
                .00. .... = Class: Control (0)
                ...0 0001 = Number: No-Operation (NOP) (1)
        No-Operation (NOP)
            Type: 1
                0... .... = Copy on fragmentation: No
                .00. .... = Class: Control (0)
                ...0 0001 = Number: No-Operation (NOP) (1)
        Timestamps: TSval 1078498, TSecr 2842752402
            Kind: Timestamp (8)
            Length: 10
            Timestamp value: 1078498
            Timestamp echo reply: 2842752402
    [SEQ/ACK analysis]
        [This is an ACK to the segment in frame: 11]
        [The RTT to ACK the segment was: 0.000048000 seconds]

0000  00 0d 9d 4f a2 71 ac 7b a1 92 58 6a 08 00 45 00   ...O.q.{..Xj..E.
0010  00 34 65 77 40 00 40 06 4e 86 c0 a8 02 79 c0 a8   .4ew@.@.N....y..
0020  02 fd bc cf 00 50 d8 fa 0f ce a2 8e ae 0d 80 10   .....P..........
0030  00 e5 e4 96 00 00 01 01 08 0a 00 10 74 e2 a9 70   ............t..p
0040  f5 92                                             ..

No.     Time           Source                Destination           Protocol Length Info
     13 0.031654000    192.168.2.253         192.168.2.121         TCP      66     http > 48334 [ACK] Seq=1 Ack=2 Win=122 Len=0 TSval=2842752403 TSecr=1078497

Frame 13: 66 bytes on wire (528 bits), 66 bytes captured (528 bits) on interface 0
    Interface id: 0
    Encapsulation type: Ethernet (1)
    Arrival Time: Sep  3, 2014 22:18:05.610438000 BST
    [Time shift for this packet: 0.000000000 seconds]
    Epoch Time: 1409779085.610438000 seconds
    [Time delta from previous captured frame: 0.002388000 seconds]
    [Time delta from previous displayed frame: 0.002388000 seconds]
    [Time since reference or first frame: 0.031654000 seconds]
    Frame Number: 13
    Frame Length: 66 bytes (528 bits)
    Capture Length: 66 bytes (528 bits)
    [Frame is marked: True]
    [Frame is ignored: False]
    [Protocols in frame: eth:ip:tcp]
    [Coloring Rule Name: ___conversation_color_filter___01]
    [Coloring Rule String: ip.addr eq 192.168.2.121 and ip.addr eq 192.168.2.253]
Ethernet II, Src: Hewlett-_4f:a2:71 (00:0d:9d:4f:a2:71), Dst: IntelCor_92:58:6a (ac:7b:a1:92:58:6a)
    Destination: IntelCor_92:58:6a (ac:7b:a1:92:58:6a)
        Address: IntelCor_92:58:6a (ac:7b:a1:92:58:6a)
        .... ..0. .... .... .... .... = LG bit: Globally unique address (factory default)
        .... ...0 .... .... .... .... = IG bit: Individual address (unicast)
    Source: Hewlett-_4f:a2:71 (00:0d:9d:4f:a2:71)
        Address: Hewlett-_4f:a2:71 (00:0d:9d:4f:a2:71)
        .... ..0. .... .... .... .... = LG bit: Globally unique address (factory default)
        .... ...0 .... .... .... .... = IG bit: Individual address (unicast)
    Type: IP (0x0800)
Internet Protocol Version 4, Src: 192.168.2.253 (192.168.2.253), Dst: 192.168.2.121 (192.168.2.121)
    Version: 4
    Header length: 20 bytes
    Differentiated Services Field: 0x00 (DSCP 0x00: Default; ECN: 0x00: Not-ECT (Not ECN-Capable Transport))
        0000 00.. = Differentiated Services Codepoint: Default (0x00)
        .... ..00 = Explicit Congestion Notification: Not-ECT (Not ECN-Capable Transport) (0x00)
    Total Length: 52
    Identification: 0x6c11 (27665)
    Flags: 0x02 (Don't Fragment)
        0... .... = Reserved bit: Not set
        .1.. .... = Don't fragment: Set
        ..0. .... = More fragments: Not set
    Fragment offset: 0
    Time to live: 64
    Protocol: TCP (6)
    Header checksum: 0x47ec [validation disabled]
        [Good: False]
        [Bad: False]
    Source: 192.168.2.253 (192.168.2.253)
    Destination: 192.168.2.121 (192.168.2.121)
    [Source GeoIP: Unknown]
    [Destination GeoIP: Unknown]
Transmission Control Protocol, Src Port: http (80), Dst Port: 48334 (48334), Seq: 1, Ack: 2, Len: 0
    Source port: http (80)
    Destination port: 48334 (48334)
    [Stream index: 5]
    Sequence number: 1    (relative sequence number)
    Acknowledgment number: 2    (relative ack number)
    Header length: 32 bytes
    Flags: 0x010 (ACK)
        000. .... .... = Reserved: Not set
        ...0 .... .... = Nonce: Not set
        .... 0... .... = Congestion Window Reduced (CWR): Not set
        .... .0.. .... = ECN-Echo: Not set
        .... ..0. .... = Urgent: Not set
        .... ...1 .... = Acknowledgment: Set
        .... .... 0... = Push: Not set
        .... .... .0.. = Reset: Not set
        .... .... ..0. = Syn: Not set
        .... .... ...0 = Fin: Not set
    Window size value: 122
    [Calculated window size: 122]
    [Window size scaling factor: -1 (unknown)]
    Checksum: 0x9918 [validation disabled]
        [Good Checksum: False]
        [Bad Checksum: False]
    Options: (12 bytes), No-Operation (NOP), No-Operation (NOP), Timestamps
        No-Operation (NOP)
            Type: 1
                0... .... = Copy on fragmentation: No
                .00. .... = Class: Control (0)
                ...0 0001 = Number: No-Operation (NOP) (1)
        No-Operation (NOP)
            Type: 1
                0... .... = Copy on fragmentation: No
                .00. .... = Class: Control (0)
                ...0 0001 = Number: No-Operation (NOP) (1)
        Timestamps: TSval 2842752403, TSecr 1078497
            Kind: Timestamp (8)
            Length: 10
            Timestamp value: 2842752403
            Timestamp echo reply: 1078497
    [SEQ/ACK analysis]
        [This is an ACK to the segment in frame: 10]
        [The RTT to ACK the segment was: 0.006339000 seconds]

0000  ac 7b a1 92 58 6a 00 0d 9d 4f a2 71 08 00 45 00   .{..Xj...O.q..E.
0010  00 34 6c 11 40 00 40 06 47 ec c0 a8 02 fd c0 a8   .4l.@.@.G.......
0020  02 79 00 50 bc ce b5 78 e9 41 4d ee 98 a6 80 10   .y.P...x.AM.....
0030  00 7a 99 18 00 00 01 01 08 0a a9 70 f5 93 00 10   .z.........p....
0040  74 e1                                             t.

No.     Time           Source                Destination           Protocol Length Info
     14 0.031701000    192.168.2.253         192.168.2.121         TCP      66     http > 48337 [FIN, ACK] Seq=1 Ack=2 Win=114 Len=0 TSval=2842752403 TSecr=1078497

Frame 14: 66 bytes on wire (528 bits), 66 bytes captured (528 bits) on interface 0
    Interface id: 0
    Encapsulation type: Ethernet (1)
    Arrival Time: Sep  3, 2014 22:18:05.610485000 BST
    [Time shift for this packet: 0.000000000 seconds]
    Epoch Time: 1409779085.610485000 seconds
    [Time delta from previous captured frame: 0.000047000 seconds]
    [Time delta from previous displayed frame: 0.000047000 seconds]
    [Time since reference or first frame: 0.031701000 seconds]
